<?xml version="1.0" encoding="UTF-8"?>
<!--W3C Schema generated by XMLSpy v2008 (http://www.altova.com)-->
<xs:schema xmlns:xs="http://www.w3.org/2001/XMLSchema">
	<xs:element name="rilevanza">
		<xs:simpleType>
			<xs:restriction base="xs:string"/>
		</xs:simpleType>
	</xs:element>
	<xs:element name="posizione">
		<xs:simpleType>
			<xs:restriction base="xs:string"/>
		</xs:simpleType>
	</xs:element>
	<xs:element name="eccezioni">
		<xs:complexType>
			<xs:sequence>
				<xs:element ref="eccezione" maxOccurs="unbounded"/>
			</xs:sequence>
		</xs:complexType>
	</xs:element>
	<xs:element name="eccezione">
		<xs:complexType>
			<xs:sequence>
				<xs:element ref="codiceEccezione"/>
				<xs:element ref="contestoCodifica"/>
				<xs:element ref="posizione"/>
				<xs:element ref="rilevanza"/>
			</xs:sequence>
		</xs:complexType>
	</xs:element>
	<xs:element name="contestoCodifica">
		<xs:simpleType>
			<xs:restriction base="xs:string"/>
		</xs:simpleType>
	</xs:element>
	<xs:element name="codiceEccezione">
		<xs:simpleType>
			<xs:restriction base="xs:string"/>
		</xs:simpleType>
	</xs:element>
</xs:schema>
