<?xml version="1.0" encoding="UTF-8"?>
<eccezioni xmlns:xsi="http://www.w3.org/2001/XMLSchema-instance" xsi:noNamespaceSchemaLocation="schema_eccezioni.xsd">
	<eccezione>
		<codiceEccezione>001</codiceEccezione>
		<contestoCodifica>ErroreIntestazioneMessaggioSPCoop</contestoCodifica>
		<posizione>Mittente</posizione>
		<rilevanza>GRAVE</rilevanza>
	</eccezione>
	<eccezione>
		<codiceEccezione>100</codiceEccezione>
		<contestoCodifica>ErroreIntestazioneMessaggioSPCoop</contestoCodifica>
		<posizione>Mittente</posizione>
		<rilevanza>GRAVE</rilevanza>
	</eccezione>
	<eccezione>
		<codiceEccezione>101</codiceEccezione>
		<contestoCodifica>ErroreIntestazioneMessaggioSPCoop</contestoCodifica>
		<posizione>Mittente/IdentificativoParte</posizione>
		<rilevanza>GRAVE</rilevanza>
	</eccezione>
	<eccezione>
		<codiceEccezione>102</codiceEccezione>
		<contestoCodifica>ErroreIntestazioneMessaggioSPCoop</contestoCodifica>
		<posizione>Destinatario/IdentificativoParte</posizione>
		<rilevanza>GRAVE</rilevanza>
	</eccezione>
	<eccezione>
		<codiceEccezione>103</codiceEccezione>
		<contestoCodifica>ErroreIntestazioneMessaggioSPCoop</contestoCodifica>
		<posizione>ProfiloCollaborazione</posizione>
		<rilevanza>GRAVE</rilevanza>
	</eccezione>
	<eccezione>
		<codiceEccezione>104</codiceEccezione>
		<contestoCodifica>ErroreIntestazioneMessaggioSPCoop</contestoCodifica>
		<posizione>Collaborazione</posizione>
		<rilevanza>GRAVE</rilevanza>
	</eccezione>
	<eccezione>
		<codiceEccezione>105</codiceEccezione>
		<contestoCodifica>ErroreIntestazioneMessaggioSPCoop</contestoCodifica>
		<posizione>Servizio</posizione>
		<rilevanza>GRAVE</rilevanza>
	</eccezione>
	<eccezione>
		<codiceEccezione>106</codiceEccezione>
		<contestoCodifica>ErroreIntestazioneMessaggioSPCoop</contestoCodifica>
		<posizione>Azione</posizione>
		<rilevanza>GRAVE</rilevanza>
	</eccezione>
	<eccezione>
		<codiceEccezione>110</codiceEccezione>
		<contestoCodifica>ErroreIntestazioneMessaggioSPCoop</contestoCodifica>
		<posizione>Messaggio/Identificatore</posizione>
		<rilevanza>GRAVE</rilevanza>
	</eccezione>
	<eccezione>
		<codiceEccezione>300</codiceEccezione>
		<contestoCodifica>ErroreIntestazioneMessaggioSPCoop</contestoCodifica>
		<posizione>Corpo</posizione>
		<rilevanza>GRAVE</rilevanza>
	</eccezione>
</eccezioni>
